VACUUM so_posts;
SELECT assert(count(*), 165240, '# of posts') FROM so_posts;
 assert 
--------
 t
(1 row)

BEGIN;
UPDATE so_posts SET id = id WHERE id IN (SELECT id FROM so_posts ORDER BY random() LIMIT 1000);
SELECT assert(count(*), 165240, '# of posts') FROM so_posts;
 assert 
--------
 t
(1 row)

SELECT assert(zdb_estimate_count('so_posts', ''), (SELECT count(*) FROM so_posts), 'estimated count');
 assert 
--------
 t
(1 row)

COMMIT;
SELECT assert(zdb_estimate_count('so_posts', ''), (SELECT count(*) FROM so_posts), 'estimated count');
 assert 
--------
 t
(1 row)

BEGIN;
UPDATE so_posts SET id = id WHERE id IN (SELECT id FROM so_posts ORDER BY random() LIMIT 1000);
SELECT assert(count(*), 165240, '# of posts') FROM so_posts;
 assert 
--------
 t
(1 row)

SELECT assert(zdb_estimate_count('so_posts', ''), (SELECT count(*) FROM so_posts), 'estimated count');
 assert 
--------
 t
(1 row)

ABORT;
SELECT assert(zdb_estimate_count('so_posts', ''), (SELECT count(*) FROM so_posts), 'estimated count');
 assert 
--------
 t
(1 row)

